{
  "dataVersion": "ce49c3cad750",
  "count": 43,
  "chunks": [
    "ch01",
    "ch02",
    "ch03",
    "ch04",
    "ch05",
    "ch06",
    "ch07"
  ],
  "lessons": [
    {
      "objective": "AI-1.1.1",
      "chunk": "ch01",
      "chapter": 1,
      "languages": [
        "en",
        "tr"
      ],
      "syllabusVersion": "2.0",
      "status": "published"
    },
    {
      "objective": "AI-1.1.2",
      "chunk": "ch01",
      "chapter": 1,
      "languages": [
        "en",
        "tr"
      ],
      "syllabusVersion": "2.0",
      "status": "published"
    },
    {
      "objective": "AI-1.1.3",
      "chunk": "ch01",
      "chapter": 1,
      "languages": [
        "en",
        "tr"
      ],
      "syllabusVersion": "2.0",
      "status": "published"
    },
    {
      "objective": "AI-1.1.4",
      "chunk": "ch01",
      "chapter": 1,
      "languages": [
        "en",
        "tr"
      ],
      "syllabusVersion": "2.0",
      "status": "published"
    },
    {
      "objective": "AI-1.1.5",
      "chunk": "ch01",
      "chapter": 1,
      "languages": [
        "en",
        "tr"
      ],
      "syllabusVersion": "2.0",
      "status": "published"
    },
    {
      "objective": "AI-1.1.6",
      "chunk": "ch01",
      "chapter": 1,
      "languages": [
        "en",
        "tr"
      ],
      "syllabusVersion": "2.0",
      "status": "published"
    },
    {
      "objective": "AI-1.1.7",
      "chunk": "ch01",
      "chapter": 1,
      "languages": [
        "en",
        "tr"
      ],
      "syllabusVersion": "2.0",
      "status": "published"
    },
    {
      "objective": "AI-1.1.8",
      "chunk": "ch01",
      "chapter": 1,
      "languages": [
        "en",
        "tr"
      ],
      "syllabusVersion": "2.0",
      "status": "published"
    },
    {
      "objective": "AI-2.1.1",
      "chunk": "ch02",
      "chapter": 2,
      "languages": [
        "en",
        "tr"
      ],
      "syllabusVersion": "2.0",
      "status": "published"
    },
    {
      "objective": "AI-2.1.2",
      "chunk": "ch02",
      "chapter": 2,
      "languages": [
        "en",
        "tr"
      ],
      "syllabusVersion": "2.0",
      "status": "published"
    },
    {
      "objective": "AI-2.2.1",
      "chunk": "ch02",
      "chapter": 2,
      "languages": [
        "en",
        "tr"
      ],
      "syllabusVersion": "2.0",
      "status": "published"
    },
    {
      "objective": "AI-3.1.1",
      "chunk": "ch03",
      "chapter": 3,
      "languages": [
        "en",
        "tr"
      ],
      "syllabusVersion": "2.0",
      "status": "published"
    },
    {
      "objective": "AI-3.1.2",
      "chunk": "ch03",
      "chapter": 3,
      "languages": [
        "en",
        "tr"
      ],
      "syllabusVersion": "2.0",
      "status": "published"
    },
    {
      "objective": "AI-3.1.4",
      "chunk": "ch03",
      "chapter": 3,
      "languages": [
        "en",
        "tr"
      ],
      "syllabusVersion": "2.0",
      "status": "published"
    },
    {
      "objective": "AI-3.2.1",
      "chunk": "ch03",
      "chapter": 3,
      "languages": [
        "en",
        "tr"
      ],
      "syllabusVersion": "2.0",
      "status": "published"
    },
    {
      "objective": "AI-3.2.3",
      "chunk": "ch03",
      "chapter": 3,
      "languages": [
        "en",
        "tr"
      ],
      "syllabusVersion": "2.0",
      "status": "published"
    },
    {
      "objective": "AI-3.3.1",
      "chunk": "ch03",
      "chapter": 3,
      "languages": [
        "en",
        "tr"
      ],
      "syllabusVersion": "2.0",
      "status": "published"
    },
    {
      "objective": "AI-3.4.1",
      "chunk": "ch03",
      "chapter": 3,
      "languages": [
        "en",
        "tr"
      ],
      "syllabusVersion": "2.0",
      "status": "published"
    },
    {
      "objective": "AI-3.4.3",
      "chunk": "ch03",
      "chapter": 3,
      "languages": [
        "en",
        "tr"
      ],
      "syllabusVersion": "2.0",
      "status": "published"
    },
    {
      "objective": "AI-4.1.1",
      "chunk": "ch04",
      "chapter": 4,
      "languages": [
        "en",
        "tr"
      ],
      "syllabusVersion": "2.0",
      "status": "published"
    },
    {
      "objective": "AI-4.1.2",
      "chunk": "ch04",
      "chapter": 4,
      "languages": [
        "en",
        "tr"
      ],
      "syllabusVersion": "2.0",
      "status": "published"
    },
    {
      "objective": "AI-4.1.3",
      "chunk": "ch04",
      "chapter": 4,
      "languages": [
        "en",
        "tr"
      ],
      "syllabusVersion": "2.0",
      "status": "published"
    },
    {
      "objective": "AI-4.2.1",
      "chunk": "ch04",
      "chapter": 4,
      "languages": [
        "en",
        "tr"
      ],
      "syllabusVersion": "2.0",
      "status": "published"
    },
    {
      "objective": "AI-4.2.2",
      "chunk": "ch04",
      "chapter": 4,
      "languages": [
        "en",
        "tr"
      ],
      "syllabusVersion": "2.0",
      "status": "published"
    },
    {
      "objective": "AI-4.3.1",
      "chunk": "ch04",
      "chapter": 4,
      "languages": [
        "en",
        "tr"
      ],
      "syllabusVersion": "2.0",
      "status": "published"
    },
    {
      "objective": "AI-4.3.2",
      "chunk": "ch04",
      "chapter": 4,
      "languages": [
        "en",
        "tr"
      ],
      "syllabusVersion": "2.0",
      "status": "published"
    },
    {
      "objective": "AI-5.1.1",
      "chunk": "ch05",
      "chapter": 5,
      "languages": [
        "en",
        "tr"
      ],
      "syllabusVersion": "2.0",
      "status": "published"
    },
    {
      "objective": "AI-5.1.2",
      "chunk": "ch05",
      "chapter": 5,
      "languages": [
        "en",
        "tr"
      ],
      "syllabusVersion": "2.0",
      "status": "published"
    },
    {
      "objective": "AI-5.1.3",
      "chunk": "ch05",
      "chapter": 5,
      "languages": [
        "en",
        "tr"
      ],
      "syllabusVersion": "2.0",
      "status": "published"
    },
    {
      "objective": "AI-5.1.4",
      "chunk": "ch05",
      "chapter": 5,
      "languages": [
        "en",
        "tr"
      ],
      "syllabusVersion": "2.0",
      "status": "published"
    },
    {
      "objective": "AI-5.1.5",
      "chunk": "ch05",
      "chapter": 5,
      "languages": [
        "en",
        "tr"
      ],
      "syllabusVersion": "2.0",
      "status": "published"
    },
    {
      "objective": "AI-5.1.6",
      "chunk": "ch05",
      "chapter": 5,
      "languages": [
        "en",
        "tr"
      ],
      "syllabusVersion": "2.0",
      "status": "published"
    },
    {
      "objective": "AI-6.1.1",
      "chunk": "ch06",
      "chapter": 6,
      "languages": [
        "en",
        "tr"
      ],
      "syllabusVersion": "2.0",
      "status": "published"
    },
    {
      "objective": "AI-6.1.10",
      "chunk": "ch06",
      "chapter": 6,
      "languages": [
        "en",
        "tr"
      ],
      "syllabusVersion": "2.0",
      "status": "published"
    },
    {
      "objective": "AI-6.1.2",
      "chunk": "ch06",
      "chapter": 6,
      "languages": [
        "en",
        "tr"
      ],
      "syllabusVersion": "2.0",
      "status": "published"
    },
    {
      "objective": "AI-6.1.3",
      "chunk": "ch06",
      "chapter": 6,
      "languages": [
        "en",
        "tr"
      ],
      "syllabusVersion": "2.0",
      "status": "published"
    },
    {
      "objective": "AI-6.1.4",
      "chunk": "ch06",
      "chapter": 6,
      "languages": [
        "en",
        "tr"
      ],
      "syllabusVersion": "2.0",
      "status": "published"
    },
    {
      "objective": "AI-6.1.5",
      "chunk": "ch06",
      "chapter": 6,
      "languages": [
        "en",
        "tr"
      ],
      "syllabusVersion": "2.0",
      "status": "published"
    },
    {
      "objective": "AI-6.1.7",
      "chunk": "ch06",
      "chapter": 6,
      "languages": [
        "en",
        "tr"
      ],
      "syllabusVersion": "2.0",
      "status": "published"
    },
    {
      "objective": "AI-6.1.8",
      "chunk": "ch06",
      "chapter": 6,
      "languages": [
        "en",
        "tr"
      ],
      "syllabusVersion": "2.0",
      "status": "published"
    },
    {
      "objective": "AI-6.1.9",
      "chunk": "ch06",
      "chapter": 6,
      "languages": [
        "en",
        "tr"
      ],
      "syllabusVersion": "2.0",
      "status": "published"
    },
    {
      "objective": "AI-7.1.1",
      "chunk": "ch07",
      "chapter": 7,
      "languages": [
        "en",
        "tr"
      ],
      "syllabusVersion": "2.0",
      "status": "published"
    },
    {
      "objective": "AI-7.1.2",
      "chunk": "ch07",
      "chapter": 7,
      "languages": [
        "en",
        "tr"
      ],
      "syllabusVersion": "2.0",
      "status": "published"
    }
  ]
}
